creator_id,id,bunny_video_id,creator_name,source_url,caption,transcript,views,likes,shares,saves,restaurant,address,km_from_downtown,creator_rank
2ddd950c-e444-433a-8814-b6fdad5f56a6,f3c2d33a-2a36-480c-99ab-99467ab0e7bd,fcd9c606-999a-4fde-bbf0-6a841372a81c,charweeezy,https://www.tiktok.com/@charweeezy/video/7249890688505023786,"Everything I Ate in a Week as a San Francisco Foodie! #sffoodie #sffood #sffoodblogger #sanfranciscofood #sanfranciscofoodie ","This is everything I eat in a week as a San Francisco foodie. I started the week off strong by eating hot chicken from Loveburn. Their fried chicken sandwiches here are huge and juicy. Then on Friday, I headed over to Sausolito to show the carnage. It's a Brazilian steakhouse that does all you can eat meat and sushi. And the sushi here was so fresh. They had so many different roles and I love that they had a lot of salmon. And their pork ribs were too die-four. Look at the amount it had of meat on my plate. Then I headed over to sushi obsession on Saturday. They do roles here like no other. And this is the new foodie sushi queen role that you can now get. I love deep fried rolls. I am a sucker for it. And this Doug Roll deep fried was so good. Sushi obsession is also known for their sushi nachos, which are so good I had to get some to go. And they also do alcoholic and non-alcoholic boba drinks. This was their strawberry pina colada. On Saturday evening, I went to a caught your prairie cooking class by the feed app. This was taught by Chef Anna. She is a Ukrainian chef, but she taught us how to make a Georgian dish. You've probably seen this dish all over social media. It looks like a cheese boat. And it had butter, eggs, and cheese in it. It was scrumptious. Then on Sunday, my family and I went to Tancadilla, Aesteka, in Dublin. They do Asian fusion Mexican food here. We got their Agua Chile, which is my favorite. Fabidia and their Mexican pizza.",241900,6721,1584,3345,Kokoria - Korean fried chicken(Sushi in Sushi),"2310 Battleford Rd Unit #5, Mississauga, ON L5N 3K6, Canada",29.85475808817,2
bcd05f64-4186-401b-b45a-b99da90315f4,38b65665-ef99-4932-aff8-5e60649b4ad9,d76d96dc-9612-44ba-9a94-493a2b330f85,friedchickenreviews,https://www.tiktok.com/@friedchickenreviews/video/7594082620305100053,"Week 93 - Reviewing fried chicken sandwiches: Burgers on Fleek🍔 Presentation: 8.5 Crispness: 8.6 Flavour: 8.3 Overall Rating: 8.5 Current Standings: 1. Chen Chen’s - 9.4 2. Simba’s Hot Chicken - 9.2 3. BTRMLK - 9.1  4. BHC Chicken - 8.9 5. Angry Wings - 8.9 6. Birdie’s - 8.9 7. Ban Ban’s - 8.8 8. THG’s Hot Chicken - 8.6 9. SMASH - 8.6  10. Knuckle Sandwich - 8.6 11. Dave’s Hot Chicken - 8.5 12. Burger’s Park - 8.5 13. Smash Kitchen & Bar - 8.5 14. B Boyz - 8.5 15. Bullger - 8.5 16. The Wren - 8.5 17. Famous Fried Chicken & Burger - 8.5 18. The Burger Shop - 8.5 19. Burgers on Fleek - 8.5 20. Uncle Sal’s Hot Chicken - 8.4 21. Aitaiker - 8.4  22. JABS - 8.4 23. Chicken N Dough - 8.3 24. Juicy Birds - 8.2 25. Samaira’s Kitchen - 8.2  26. Boardwalk - 8.2 27. Aloette Go - 8.1 28. Super Chicken - 8.1 29. Krispy’s Kajun Chicken - 8.1 30. Koryo - 8.1  31. El Jefe De Pollo - 8.1 32. Frankie’s Diner - 8.1 33. Chica’s - 8.0 34. Chick N Joy - 8.0 35. Matt’s Burger Lab - 8.0 36. Daddy’s Chicken - 8.0 37. Cluck Clucks - 8.0 38. Birdcall - 7.9 39. Knockout Chicken - 7.9 40. Grand One Chicken - 7.9 41. Church’s Texas Chicken - 7.9 42. Cabano’s - 7.9 43. The Chicken Cartel - 7.9  44. Death & Taxes Free House - 7.8 45. Fancy Franks - 7.8 46. RUDY - 7.7 47. The Dirty Bird Chicken + Waffles - 7.7 48. GG’s Burgers - 7.7 49. Rosie’s Burgers - 7.7  50. Jack Astor’s - 7.7 51. Shake Shack - 7.7 52. Beauty’s Fried Chicken - 7.6 53. Horn Dawgs - 7.5 54. Honestly Good Chicken Fingers - 7.5 55. Loblaws - 7.5 56. Slider Station - 7.5 57. GC Burger - 7.5 58. Jollibee - 7.4 59. Raising Cane’s - 7.4 60. Frankie’s Nashville Chicken - 7.4 61. Frangoz Fish & Chicken - 7.3 62. Burgers by Mazadar - 7.3 63. Original Shawarma - 7.3 64. Popeye’s - 7.2 65. The Heartbreak Chef - 7.2 66. Chicken Kitchen - 7.2  67. Food Fight BBQ - 7.2 68. Hero Burger - 7.2 69. Harry’s Charboiled - 7.2 70. Burger’s Priest - 7.1 71. Swiss Chalet - 7.1  72. Habibz Corner - 7.1 73. WingsUp! - 7.1 74. Triple O’s - 7.0 75. Chick-fil-a - 7.0 76. Big Bone BBQ - 7.0 77. Slayer Burger - 6.9 78. Happy Burger - 6.8 79. Checkers - 6.6 80. South St Burger - 6.6 81. 6ix Burgers - 6.6 82. Harvey’s - 6.6 83. KFC - 6.5 84. Mr. Six Fried Chicken - 6.5  85. Mary browns - 5.7 86. PG Clucks - 5.5 87. Tim Hortons - 5.5 88. A&W - 5.4 89. Burger King - 5.2 90. Chickqueen - 5.2 91. Pizza Pizza - 5.0 92. Wendy’s - 4.3 93. McDonald’s - 4.2 . . . #friedchickenreview #foodreview #foodreviews #friedchicken #food  ","I'm on a mission to find the best fried chicken sandwich in Toronto. I've tried over a hundred and currently a ched And today we're at burgers on fleek. Zoom in. Nice. Today we've got the goat chicken sandwich. I'm genuinely scared of this thing. I don't know how to get this out honestly. This is the goat chicken sandwich from burgers on fleek. They said this was their best sellers So I'm like I got to get this one, but Jesus Christ dog. All right for presentation This is impressive, man. I can say I've definitely never seen a fried chicken sandwich that looks like this And for that alone like the uniqueness of whatever this is this is getting an eight five. Let's see what's inside They got lettuce tomato in there. Cheese mayo. I think this is like peppers and god knows what else. All right, let's take a damn bite. I suppose Taste is pretty good. Let's get some crispiness It's definitely crispy. I mean you can tell it's crispy. All right, it could be a little better That's getting an eight six for crispiness and for flavor. Now it's really tough to get an actual good bite of this thing But I did my best the sauce is really nice the cheese actually helps a lot of the time the cheese just makes a sandwich Worst to be honest. I think a lettuce and tomato is pretty unnecessary in here I didn't get to it yet, but the cheese is sauce a peppers and the chicken itself pretty good I'm gonna give this an eight three for flavor. That's burgers on fleek",236900,9362,2082,1893,Gladiator Burger & Steak,"5165 Dixie Rd, Mississauga, ON L4W 4G1, Canada",19.57730650821,3
228d6941-6357-4e72-af8f-e438427e9c95,51d332dd-32d7-4cf4-8475-f070e98173f3,486b81a4-27dc-44f7-8af7-56cb9008757b,thecaroandtina,https://www.tiktok.com/@thecaroandtina/video/7501383260061338926,"trying the viral mango ice cream🍦🥭 #mangoicecream #tastetest #viralicecream #viralfood #foodtrend #hmart #foryoupage #foodreview #icecream #atlanta #chinesefoodlover #asianicecream ","Okay, finally found the viral Asian ice cream in Atlanta. It was a struggle to find these little cuties, but once we heard they were here, we ran. The mango's outer shell was insane. Perfectly thin and a little snap when you take your first bite. Look at how smooth and creamy it is. Pretty sure it's like 99% condensed milk, which is why I'm addicted. Now the peach flavor, you know it looks good. It's honestly on the floral side and more artificial tasting, but still super satisfying, we couldn't stop taking a bite.",231300,5963,1808,1152,The Mango Place - Hui Lau Shan Mississauga Boba + Desserts,"521 Curran Place, Mississauga, ON L5B 0H4, Canada",22.55915417833,5
e3aec250-70d7-44ff-815a-3ff3b53479bc,5d35f797-057e-494c-88ee-a46801b8dd08,17eb750c-8b1e-4b0e-9c95-c13c53c19beb,josephdebenedictis,https://www.tiktok.com/@josephdebenedictis/video/7621717147957382413,Unreal.🤯🥲 Boa Balery wins best cheese slice in the world at the International Pizza Expo. Bakery in Hamilton / Binbrook Ontario. Kevin also came first in best non-dairy pizza!!  This was a path carved out by fellow Hamilton pizzeria Cowabunga who won best cheese slice 2 years ago. There’s something special happening in Hamilton.  Some special words from judge @Scott’s Pizza Tours near the end of video.  Also cheering him on in video is Mercasa in Bra #pizza #canada #hamilton,"[00:00-00:02] Best she's placed by the B&M's. [00:02-00:03] Second place. [00:03-00:05] Donnie Sparino. [00:05-00:06] OK. [00:06-00:07] Come on, Kevin. [00:07-00:08] Come on, Kevin. [00:08-00:09] Come on, come on. [00:09-00:10] Let's go. [00:10-00:11] Come on. [00:11-00:12] This is Kevin. [00:12-00:14] Yeah! [00:14-00:15] Yeah! [00:15-00:17] Come on, yeah! [00:17-00:18] Come on, yeah! [00:18-00:19] Come on, yeah! [00:19-00:21] Come on, yeah! [00:21-00:23] Come on, yeah! [00:23-00:24] Let's go! [00:24-00:25] Let's go! [00:25-00:27] Come on, Kevin! [00:27-00:28] Woo! [00:28-00:30] That's crazy. [00:30-00:32] Oh my god! [00:32-00:34] Fimbra, Cavalty, Ontario. [00:34-00:35] Wow. [00:35-00:37] Come on, come on, come on, come on. [00:37-00:39] Now it's the notch of the storm. [00:39-00:40] Come on, come on, come on. [00:40-00:41] I just... [00:41-00:43] Oh, look. [00:43-00:44] Oh, look. [00:44-00:45] You can just drink these. [00:45-00:46] You can just drink these. [00:46-00:47] Come on, come on. [00:47-00:49] Now it's the notch of the storm. [00:49-00:52] I didn't know you were going to like stand out. [00:52-00:53] Thank you. [00:53-00:54] That's Chris. [00:54-00:56] But he's the... [00:56-00:57] Wait, he's not got another competition. [00:57-00:59] He's like a bomb with... [00:59-01:00] Congratulations. [01:00-01:01] Thank you. [01:01-01:02] Thank you. [01:02-01:03] Thank you.",224818,10777,4007,0,Boa Bakery,"County Road 56, 3200, Hamilton, ON, L0R 1C0, Canada",68.94969780067,1
c5aa099d-ebbf-47cc-b26e-a662cf30d82d,e99c98a7-8ffa-48a4-b55b-a00913c4d950,068e1b4f-8dc8-49d9-9720-b1b5d632dba6,ourhungergoals_,https://www.tiktok.com/@ourhungergoals_/video/7464273530675367173,"🇨🇦 Canada’s Largest Indian Buffet has the most amazing deal! 🍛✨ 🌟 Toonie Tuesday Special: Buy 1 Buffet ($24.99)+ 1 Drink and get the 2nd Buffet for ONLY $2! 🎉 Prices for Adult buffet starting as low as $24.99 only  With over 150+ dishes to choose from, including creamy curries, sizzling tandoori items, aromatic biryanis, South Indian, Hakka cuisine and indulgent desserts, this is the buffet experience you’ve been craving! 🙌 📍 Location: 90 Courtneypark Dr E, Mississauga, ON L5T 2Y3 📅 Bring your foodie squad and make Tuesday the tastiest day of the week! #KwalityGrandIndianBuffet #ToonieTuesday #BuffetDeals #CanadasLargestIndianBuffet #MississaugaEats #IndianFoodie #FoodHeaven #FoodiesOfMississauga #ourhungergoals @Kwality Restaurants ","Start Time	End Time	Subtitle
00:00:00	00:00:01	Hey, friends.
00:00:01	00:00:04	Sorry. We are taking you to Toronto's Grand Indian Buffet.
00:00:09	00:00:11	On to the main course, guys.
00:00:11	00:00:14	We have some Chinese, North Indian, South Indian.
00:00:23	00:00:25	The dessert options are crazy.
00:00:25	00:00:26	You really can't choose one.",222900,2395,1836,1420,Kwality Grand Indian Buffet,"90 Courtneypark Dr E, Mississauga, ON L5T 2Y3, Canada",24.99202048584,1
a3d05915-cdb9-49db-b437-e157720fca55,4d002a91-6706-4c35-ba4f-b841179ab07c,5e3c21a4-69c1-4688-a572-599c65caecde,craveshack,https://www.tiktok.com/@craveshack/video/7357001601606880517,"📍Dragon Pearl 865 York Mills Rd #2, North York Rating 8/10 #fypシ #fypシ゚viral #fyp #toronto #foodreview #craveshack #like #follow #comment #discover #review #buffet #chinese #northyorkfood #northyork #like #review #viral ","[00:00-00:03] This is probably one of the best buffets in Toronto. [00:03-00:10] What is Up Cravers? We're here at Dragon Pearl in North York, and I'm telling you, this is probably one of the best buffets in Toronto. [00:10-00:14] Off the bat you walk in and the Chinese decor was immaculate. [00:14-00:18] It was like, everywhere you turn it made you feel like you were taken to the Chinese culture. [00:18-00:24] One thing I hate about buffets is the limited options they sometimes have, but this place did not hold back on options. [00:24-00:26] They literally had everything. [00:26-00:31] The thing I can truly say is that every person that served me in this place had a smile on their face. [00:31-00:36] The food, it tasted fresh, authentic, and it didn't shy out on flavor. [00:36-00:39] They had a duck wrap that was sold juicy and tender. [00:39-00:46] I also got lamb. Yes, you heard me. They had lamb shanks, and the flavor was on 10. [00:46-00:51] Everything was delicious, and I'm telling you guys this is the next buffets spot you need to try. [00:51-00:53] I'm giving this place an 8 out of 10. [00:53-00:56] Remember to like, comment, and share, and repose. [00:56-00:58] You already know what to do, peace.",221913,3821,2070,1276,Dragon Pearl Buffet Chinese All-You-Can-Eat North York Address,"865 York Mills Rd #2, North York, ON M3B 1Y6",11.50068094167,1
d61dc4e5-c160-4cc3-b4d2-9ece97e3c921,e994153b-944a-4110-a2c7-34dee200f82b,d12a3d4f-ed0c-430a-92de-35d0847b88aa,bussin.boys,https://www.tiktok.com/@bussin.boys/video/7502965991773703455,"Touched my soul🇪🇹❤️ #ethiopianfood #dorowat #tej #tibs #injera #ethiopianmusic #ethiopia #ethiopiancoffee #ethiopian_tik_tok #ethiopian_tik_tok🇪🇹🇪🇹🇪🇹🇪🇹 #habeshatiktok #habesha #habeshantiktok #habeshagirl ",I'm a saddingy damn-o I'm a saddingy damn-o I'm a...,218700,13300,544,1016,King Solomon and Queen of Sheba Ethiopian Restaurant,"360 Queen St E, Toronto, ON M5A 1T1, Canada",1.58488712284,1
9c451009-3a7f-45c1-a887-a3742147e0c0,3f170ff9-3e89-47b7-b3fa-9672d2a53fc7,e4216d04-5f60-4443-a551-bce4b4f6906c,seattlehalalfoodie,https://www.tiktok.com/@seattlehalalfoodie/video/7479922509538692394,"Halal at Restaurant Depot 🛒 ✅ No Membership Needed! Anyone can shop here—no need to be a restaurant owner. Just enter your name & driver’s license at the entrance to get a 📜 day pass (takes 1 minute!). ⚠️ Day Pass Limitation: No returns allowed, but not a big deal for me! 📦 Sizes? While many items come in large boxes, there are plenty of smaller, convenient packages too! 🥩 Biggest Halal Selection I’ve Seen! 🔎 What I Found: 🦙 Lamb, Goat, Veal, Mutton – A whole freezer section of imported Australian & New Zealand meat 🇦🇺🇳🇿 🐄 Beef – Almost every cut imaginable, plus organs & ground beef 🐓 Chicken – Both hand-slaughtered ✋ & machine-slaughtered 🤖 (but more machine-slaughtered options) 🍔 Extras: Burger Patties 🍔 | Pepperoni 🍕 | Sausage 🌭 | Pastrami 🥪 | Chicken Wings 🍗 | Meatballs 🏀 & more! 📍 Restaurant Depot Location: 📌 6219 238th St SE, Woodinville, WA 98072 🔔 Follow @seattlehalalfoodie for the latest halal discoveries! 🛒 Restaurant Depot has 130 locations across 33 states! #️⃣ Hashtags: #costco #halal #halalmeat #halalcostco #restaurantdepothalal #halalinusa #halalgrocery #halalusa #restaurantdepotdaypass #halalfoodieseattle #halalseattle #halalnyc #dallashalal #chicagohalal #bayareahalal #houstonhalal #dfwhalal #socalhalal #atalantahalal #detroithalal #halalnuggets #halalchicken #crescentfoods #halalpastrami #halalhotdog #halalbacon #socalhalal @Crescent Foods ","You don't need a membership to shop at restaurant deeper. Just fill out your information at the entrance, get your day pass and join me for a hallal shopping. You don't need a membership to shop at restaurant deeper.",215600,5089,2433,1548,Laith Meat Shop,"223 Ceremonial Dr #9, Mississauga, ON L5R 2N3, Canada",23.22019513574,1
a1eb9e01-edb5-4a8d-ab7a-3c7090d9502d,4658e8c3-7801-4525-9857-eaa87256c3a5,f50d5933-f2a1-4509-8d0e-90f775d3008d,foodiebros_to,https://www.tiktok.com/@foodiebros_to/video/7509860655407680773,"Guys! This was a great BBQ experience.. everything was so delicious and mouth watering! 🤤 Northern Smokes in Scarborough is definitely a spot you guys have to try out.  #foodiebros #fyp #foryoupage #food #foodforthought #foodblogger #foodbloggers #restaurantreview #restaurants #scarborough #northernsmokes #bbq #gta #toronto #foodies #foodreview ","[00:00-00:03] Guys, you wanna know one of the best places to get barbecue in the city? [00:03-00:05] We went to Northern Smokes in Scarborough. [00:05-00:08] As we walked in, we got hit with the smell of barbecue, [00:08-00:10] and they have vintage and modern sportsmen, [00:10-00:11] and we were there from Wal-Tawal, [00:11-00:13] breast and piece black mamba. [00:13-00:17] We were then introduced to the lying barbecue smoker by the owner, Imran. [00:17-00:19] He says with the climate that we have in Canada, [00:19-00:21] he wants to be able to take his ribs and brisket out [00:21-00:23] and be able to load them without losing heat. [00:23-00:25] They use quality red oak wood, [00:25-00:28] then split them for the best fire possible. [00:29-00:32] He also explained to us that the brisket or the entire cow [00:32-00:34] was brought in from Alberta, [00:34-00:37] and their always primer certified Angus Platinum. [00:37-00:38] We got sample powder one. [00:38-00:41] You get a pound of juicy brisket and beefback ribs. [00:41-00:44] A half pound of tritip and a pound of chicken legs. [00:44-00:45] What more can you ask for? [00:45-00:48] They even hooked us up with some of their Korean short ribs [00:48-00:50] and some of their massive dinar ribs. [00:50-00:53] All of this could feed at least three to four people easily. [00:53-00:55] Everything was made fresh and it takes time. [00:55-00:57] There was so much meat on the plate, [00:57-00:58] we didn't know what to do. [00:58-00:59] You have your choice of two sides, [00:59-01:01] and we got the mac and cheese and coleslaw. [01:01-01:04] The mac and cheese was extremely creamy and cheesy. [01:04-01:06] Guys, we had a problem though. [01:06-01:08] Everything was just falling apart on us. [01:08-01:12] The beef brisket and dinar ribs were super tender and packed with flavor. [01:13-01:16] We can't forget their in-house barbecue sauce. [01:16-01:17] One dip isn't enough. [01:17-01:20] Their Korean short ribs have the perfect char [01:20-01:21] and they melt in your mouth. [01:21-01:23] Selvin had to get one last bite in [01:23-01:26] and their cornbread is baked fresh every day. [01:26-01:29] Northern Smokes gets the foodie bros gold seal of approval.",212900,5223,2013,2246,Northern Smokes,"371 Old Kingston Rd #12, Scarborough, ON M1C 1B7, Canada",22.44312246778,2
0f506bb6-ee9f-47f6-8197-702774322db4,8845de1a-30c6-4060-8f10-8f161da44f5b,5f86717f-f94c-4906-8578-cb27e0275d0b,oxtailpapi,https://www.tiktok.com/@oxtailpapi/video/7214608635656178949,"Peppers caribbean restaurant.  Im typing this feeling lavish after feasting on this food. #jamaicanfood #torontofood #foodreview #torontotiktok #caribbeanfood #reaction #jamaicatiktok #foodtiktok #oxtail #curry #currygoat #keithlee #fyp #Foodie #peppers #spice #friedchicken ","[00:00-00:02] One of the best to make a spot in... [00:02-00:04] I was gonna see the West End, maybe even Toronto. [00:04-00:07] It can bang with any of the spots you tell me. [00:07-00:08] This... [00:08-00:09] Peppers. [00:09-00:10] Look at this. [00:10-00:14] The largest, large, and this is all under 19 bucks.",211932,7759,1715,2688,Peppers Caribbean Restaurant,"3027 Islington Ave, North York, ON M9L 2K9",19.23126183538,4
c5d9ed8d-a2b0-4de2-b68f-aa1c3cf18ae4,77f4149f-9a1b-4197-b773-51d1b8f2612d,f8b81705-ac93-4028-ac73-af69b15f254f,davebites,https://www.tiktok.com/@davebites/video/7556368396279991570,"Replying to @eugene_twd1 @Shelby’s Canada DM’d me after my honest review of their shawarma went viral. I knew it might have been a bad location/employee, so I decided to try it again, at the location of their choice. It was like night and day. #shelbyscanada #shawarma #toronto #Foodie #erinmills ","[00:00-00:04] So Shelby's Swarmaman DM me after my review went viral. [00:04-00:09] I told him I was willing to do a follow up video unannounced at the location of his choice. [00:09-00:13] He chose Aaron Mills so I decided to go there and gave him another chance. [00:13-00:18] What I didn't expect was that a Swarmman himself was there shooting videos for his social [00:18-00:22] media and although I don't think he knew who I was, he did say something to me which [00:22-00:23] I tell you in a sec. [00:23-00:28] Anyways, I ordered the exact same Swarm as it did last time but this time the moment I [00:28-00:31] held it, I knew it was different. [00:31-00:35] It was much heavier, it was bigger, the outside was nicely grilled and it had a ton of [00:35-00:36] meat. [00:36-00:39] I even opened it up to show you guys how much meat was in this thing. [00:39-00:42] It was like the opposite of what I had at the location. [00:42-00:47] I'm not lying, it's definitely as tiered, possibly the best Swarm I've ever had. [00:47-00:48] It was delicious. [00:48-00:52] This is the legendary Swarm I was hearing about and I hope the franchisees can keep more [00:52-00:54] consistent with this standard. [00:54-00:59] Oh yes, the comment he made, he was watching me take video and after I opened up the Swarmman [00:59-01:03] or showed the shot at me, he said to me, is the Swarm okay? [01:03-01:06] I've never seen someone dissect the Swarm like that. [01:06-01:10] He seems like a nice guy and I have like a new respect from now because this Swarmman [01:10-01:11] is really something special.",211341,5062,112,636,Shawarma Q,"987 Bay St., Toronto, ON M5S 3C4, Canada",1.36632942771,4
a1eb9e01-edb5-4a8d-ab7a-3c7090d9502d,a2cc160a-c2c8-4686-9321-c4cba8ae8566,b72e7deb-417a-46d0-9009-f8a2f3fad089,foodiebros_to,https://www.tiktok.com/@foodiebros_to/video/7475390412480417079,"Guys! We drove down to Markham from Ajax to try this hidden gem Jennies fruity bowl. The fruits are so refreshing and the coconut milk base is the perfect touch to bring it all together. We will definitely be back! 🍓🥝 🥭 🍍  #mkmedia #foodiebros #itsnotwork #lovewhatwedo #lovewhatyoudo #foodforthought #markham #jenniesfruitybowl #pacificmall #fyp #foryoupage ","[00:00-00:04] Guys, today we drove all the way from Durham to Pacific Mall in Marcom. [00:04-00:09] We've heard so much about the viral fruity bowl from Jenny's fruity mix on the upper level. [00:09-00:13] All you have to do is head down the hall and up the escalator towards the golden court. [00:13-00:15] Once you pass the lucky bridge, you're basically there. [00:15-00:18] They start off with a generous amount of coconut milk. [00:18-00:24] Then you choose whatever fruit you want, like grapes, kiwi, dragon fruit, mango, [00:24-00:26] strawberry, and even pineapple. [00:26-00:29] You can even top it off with popping bulba and more coconut milk. [00:29-00:34] The bowls are filled to the top with a combination of freshness and flavor. [00:34-00:38] This fruit bowl was so good that I had to finish the entire thing. [00:38-00:41] Nothing was left behind. Just look at yourself as your action.",211200,7896,2229,1403,Jennie’s Fruity Mix,"4300 Steeles Ave E, Markham, ON L3R 0N8, Canada",20.20694558503,3
70618f7f-6429-4973-aad8-2f95b1842eb8,13e6ff7e-47b4-4844-8468-3b6af2e48fae,11b6ca0a-dbb2-48a6-b01e-d0a3bd971779,6ixfoodie1,https://www.tiktok.com/@6ixfoodie1/video/7588284656571747602,"Messi shawarma been blowing up its alr reminds me of Osmows service was amazing tho super nice small store in Brampton but really busy @MESSISHAWARMA #food #trend #fy #restaurant #toronto ","[00:00-00:02] Trying messy showermost plate. [00:02-00:04] So I've been seeing these guys all over TikTok. [00:04-00:06] I got their most famous thing, which is fries, [00:06-00:10] chicken, rice, and a whole lot of sauce. [00:10-00:11] This plate is really heavy, [00:11-00:13] and it cost me $20 after tax. [00:15-00:16] Try the fries. [00:16-00:19] The rice is good, it's the best part. [00:19-00:21] The chicken, it's soft, but it's chewy. [00:21-00:24] And the fries, they get soggy from the sauce. [00:24-00:27] The sauce is good, but I might be garlic sauce, [00:27-00:28] but I don't taste any garlic. [00:28-00:30] If it's garlic sauce, I don't taste any garlic sauce. [00:30-00:33] I'll give it like a 8.4, and I'll see you guys in next video.",210100,14700,1303,1348,Messi Shawarma,"1975 Cottrelle Blvd Unit # 02, Brampton, ON L6P 2Z8, Canada",27.92207037172,2
