creator_id,id,bunny_video_id,creator_name,source_url,caption,transcript,views,likes,shares,saves,restaurant,address,km_from_downtown,creator_rank
f5da062e-48b5-4437-ace4-8d0d13ad3dd9,eafa4612-dc4c-4cf1-974d-94741f9c4fdd,20292fac-29c8-4693-90d8-ef48c77d9c49,meglobbers,https://www.tiktok.com/@meglobbers/video/7578027984154561806,happy thanksgiving!!!!!!!,"I was in charge of this year's Thanksgiving menu and there were only two requests that my family had and that was no ham, no turkey So this was everything I made for Thanksgiving and the menu was semi-Asian inspired this year I started off by prepping the veggies the day before This actually took hours for me to finish I have this long process of washing my veggies because I don't want those pests to size in my system and I'm scared of bugs Shout out to Rachel Ray, she ate it up with the garbage we'll have Then the next day the pressure was on because it was Thanksgiving First thing on my list was to go pick up the duck So to weren't having ham or turkey I thought pecking duck would be fai-yaa Peeking or pecking duck because my mom is always laughing at me for saying pecking Anyway, since the line was so long she went to go grab some donthada Spun spread for snacking on then we finally grabbed our duck and then was time to get cooking I started with the sweet potato casserole We usually make this every year so I decided to keep it on this year's menu Topped up a bunch of sweet potatoes, boiled them, smashed them Then I put it aside so I could top it with marshmallows later Okay, next up were the smashed potatoes and they turned out so good I'm gonna be honest when I cook it can it can be a hit or miss Even though they're just potatoes I was scared that we're gonna be super mushy or something But I'm so happy they turned out like this Next up was honey walnut shrimp and I will say the shrimp turned out good but the walnuts I basically made boiled walnuts Also made some rice to go along with everything Started adding peas for fiber I cut some Brussels sprouts and then put my sister in charge of roasting both the sprouts And the carrot I assembled the charcuterie board while waiting for the jolly bee And the chow fun to arrive And then everything started to come together My mom made her tomato salad Guys I think this is the best spread we've ever had for Thanksgiving Looking at him made me so happy Oh my gosh, my smashed potatoes can't forget about the smashed potatoes And that pecking dog I was really proud of how everything turned out And that's everything I ate for Thanksgiving",445100,65800,750,2833,SOUTHIE’S KITCHEN,"7251 Copenhagen Rd, Mississauga, ON L5N 2H6, Canada",31.90875391968,1
a1eb9e01-edb5-4a8d-ab7a-3c7090d9502d,637914aa-ce69-4f28-b31c-133ed05f8919,1653e591-80c1-47ce-ad62-10c94aa6cacb,foodiebros_to,https://www.tiktok.com/@foodiebros_to/video/7501327663693417783,"Pizza On Fire is known for one of the best places to get a pizza in the city. We had the pleasure of meeting the owner Jack, he's the man behind it all. You guys have to try this place out! 🍕 🔥  📌 880 Ellesmere Rd Unit 10, Scarborough #fyp #foryoupage #food #foodie #foodblog #blogger #scarborough #kennedyroad #pizza #pizzaonfire #foodiebros #mkmedia23 #kennedyroadbia ","[00:00-00:02] Guys, you want to know one of the best places to grab a pizza? [00:02-00:04] That's here at Pizza On Fire. [00:04-00:06] Here's Jack, the man behind Pizza On Fire. [00:06-00:09] Selvin and I went with half meat lovers and half Hawaiian. [00:09-00:12] Their dough is handmade and always fresh. [00:14-00:19] The dough is formed perfectly, and then the crust is brushed with their special garlic butter. [00:19-00:21] And then it's hit with their signature tomato sauce. [00:21-00:25] And then behind us, they were preparing the meat for their Philly G's sake pizza. [00:25-00:29] Jack puts so much love into his pizzas, and he never skimps on the toppings. [00:29-00:32] It's fully loaded and well layered from top to bottom. [00:32-00:35] Oh yes, pineapple belongs on pizza, and so does Bacon. [00:36-00:41] Jack's quality of food control is top notch, and nothing leaves the kitchen before he checks it. [00:41-00:43] He always adds more cheese before it goes back in the oven. [00:43-00:45] Just look at that, guys. [00:45-00:47] You need to try this. [00:47-00:49] And the blowtorch is a finishing touch. [00:49-00:51] Guys, he even has poutine. [00:51-00:55] With fresh cut fries, cheese curds, and an in-house gravy. [00:56-00:59] And the bacon is cooked in the oven and then placed right on top. [00:59-01:01] When you go, just ask for Jack. [01:01-01:02] He will take care of you. [01:02-01:03] Just look at this creation. [01:03-01:08] And did you know that pizza and fire is one of the five most unique spots to eat in Toronto? [01:08-01:09] The cheese poll was pulling. [01:09-01:13] Now this is a delicious poutine and it could feed more than one person for sure. [01:13-01:17] We love their fresh ingredients, and they also offer halal options. [01:17-01:20] We'll definitely be back to try their tendery and salmon pizzas. [01:21-01:25] This was beyond delicious and guys, this pizza slat me into a full [01:25-01:26] coma. [01:26-01:29] I need to unfire, it gets to foodie bros gold seal of approval.",443500,17500,4567,6060,Pizza On Fire,"880 Ellesmere Rd Unit 10, Scarborough, ON M1P 2L8, Canada",15.00027830035,1
09904c92-652f-429f-861c-c854c9602580,c5c3d6fc-5a2f-4879-90a9-d64edbfc830f,2c17e9c5-75b1-4e07-a25e-01d9b161c705,aarnvrr,https://www.tiktok.com/@aarnvrr/video/7205740981776387333,"Replying to @IntersectionalOdy danishes at monmartre bakery 🍞#toronto #torontofood #tiktokfood #foodtiktok #hiddengems #bakery #danish #bread #pie #strudel #howto #learnontiktok #fyi   ","00:00:08 
Right over there is Midland

00:00:47 
What a sight to behold. For a place located in a pretty industrial part of town

00:00:41 
I'm a sucker for a good 🫐 one.

00:00:30 
like there's no place to sit.

00:00:37 
But I come here for pies and in this instance, danishes.

00:00:54 
They do way more than I had mentioned

00:00:28 
and if you head inside it's legit a bakery,

00:00:26 
This is a pretty humble spot

00:00:11 
and follow this curve until you reach the destination.

00:00:19 
But from Midland it actually isn't too far of a walk.

00:00:06 
So this is a bakery located in Scarborough.

00:00:14 
Now this is definitely more of a driving situation,

00:00:25 
And we arrived!

00:00:04 
and here's how to find this one.

00:00:45 
and…beautiful!

00:00:56 
so visit them to see what else they got!

00:00:52 
I'd say this is well worth the trek.

00:00:33 
This place is known for a number of things including strudels and pretzels.

00:00:31 
It’s typically just take-out.

00:00:43 
I had to unpack these when I got home.

00:00:17 
I'm sort of just walking to show you how to get to this place.

00:00:01 
Putting you on to actual hidden gems in Toronto

00:00:09 
and you're gonna wanna take this street

00:00:21 
Bakery so popular that other businesses don't want you to use their parking.",433300,32300,6623,9974,Montmartre Bakery Danish Scarborough Address,"105 Midwest Rd, Scarborough, ON M1P 4B9",14.56672365262,3
30aea502-d6c7-4d53-866e-3a14787239b5,dfd56b95-56fd-4a48-af2e-7ad368602799,6ad18190-0a23-48fa-ae29-d788c0ff052a,great_eats,https://www.tiktok.com/@great_eats/video/7589411015373163807,"Honey Bun Smash Burger.. Big Back Activities with Mr Great Eats at @eatbigmouths ❤️❤️❤️❤️ 📍 5851 Buffington Rd, Atlanta, GA 30349 #atlanta #burger #honeybun #greateats ","Have you tried a honey bun smash burger? Well, I had to make the truth. Not only do they have a honey bun smash burger, they got a smash burger for $10 and some of the best wings in the city. And this is only at Big Mouth's. Cordy Agriir. Well, put a lot of this up on Instagram, it's the greatest and I had to go make the trip to Big Mouth's man because I seen that honey bun smash burger and I ain't seen nothing like it in the city. Not only do they have burgers, man, you can get the Habatchi lobster and beef. Boy, and these wings 10 out of 10, bro, 10 out of 10. Like I said, they even got a smash burger for $10, man. You can't go wrong with this spot. Them wings definitely in my top 10 and I will be returning it for them. They even got Cajun chicken pasta and a lobster burger. I'll definitely be back for that as well. I ain't get the chance to try it, but they got a new meal yard and I'm the walking tacos. Did you get the chance to try them, man? Yeah, exactly what it looked like. Had to bring the fam out to try them wings, man. And they was like, yeah, yeah. That honey bun smash burger for the 101. So if you're in the new and area looking for something different, tell them Mr. Grant East and you blah.",431800,30800,12600,9964,Smashed Patty,"1474 Pickwick Dr, Mississauga, ON L5V 2G2, Canada",26.74686875943,1
2a9e7755-565d-4148-b35d-780e2d172f9e,a2aa7c65-3d92-4c68-af46-1b33969b3a29,6fc6d0ac-f47b-4deb-a28c-e54146d12557,ryaneatzz,https://www.tiktok.com/@ryaneatzz/video/7494354413146869035,"Trying croissants 🥐 from @Tous Les Jours USA #croissants #viralcroissant  #creatorsearchinsights ","Check out these chrissants I got from two less drawers. You're a two-sweetie chrissant. Got a strawberry chrissant, chocolate chrissant, cocoa hazelnut chrissant. Start with the cocoa hazelnut, top with chocolate, fill with hazelnut spray. Like I'll solve for this. Hold up now. The chocolate on the top is a very nice touch. Delicious. I'm at the Get Eddon like at 8.7. Very good, very good. Delicioso, got the chocolate chrissant, dipped in chocolate with some almonds topped on Eddon. I think they use like a dark chocolate on the top. It's not crazy sweet, like the chocolate is not crazy sweet. Look at our areas. I might have to get at one like at 8.5. The strawberry chrissant, filled with cloud cream on top with strawberries. You know you got the powder sugar on the side. Quality, qwassam. Strawberry, steak, fresh. That's a good sign. And the cloud cream isn't that sweet at all. Pretty much tastes like whipped cream. It's good. 8.4. If you love strawberries, you will love this. Two less drawers. If you're in an area, try them out. Let me know what you think. Peace out.",417100,41400,3893,3806,Lazar Famous Deli & Bakery,"325 Central Pkwy W Unit 12, Mississauga, ON L5B 3X9, Canada",21.97420332101,5
fc626f6e-a735-4c07-81f2-f94ec981c2be,fb778b93-6fcf-4065-8d0c-8a3503aa068f,d13c6dd2-abdd-4ff0-a1cf-bfe0a9f36cee,halalornothing,https://www.tiktok.com/@halalornothing/video/7259809073103637766,I expect nothing less from kensignton market 😩 #halal #toronto #halalornothing #halalfood #wagyu #smashburger,"Start Time	End Time	Subtitle
00:00:00	00:00:01	Let me put you guys on a spot
00:00:01	00:00:04	serving up halal Wagyu smash burgers in Toronto.
00:00:04	00:00:06	This place is called Ugly Delicious
00:00:06	00:00:07	in Kensington Market,
00:00:07	00:00:09	and these burgers are packing some serious flavor
00:00:09	00:00:11	and juice. I had the Jalapenos Gone Wild burger,
00:00:11	00:00:13	which was a wacky burger
00:00:13	00:00:15	topped with a spicy jalapeno concoction.
00:00:15	00:00:17	The Burger Royale on sourdough bread.
00:00:17	00:00:19	And I had their signature ugly fries.
00:00:19	00:00:21	Nobody is doing this in Toronto.
00:00:21	00:00:22	Definitely check these guys out.",416400,23700,9848,9244,Ugly Delicious Toronto,"199 Baldwin St, Toronto, ON M5T 1M1, Canada",1.50409536472,4
ec15c8cd-6e6e-4731-89ad-51265f0904dd,a0ef5fc0-50dc-4301-bb89-16c31c26382f,8d7f6a3a-6bfc-4702-bbbf-241a36ab68af,dudelovesfood,https://www.tiktok.com/@dudelovesfood/video/7467692134150229279,"We just experienced a buncha new, bright, flavorful dishes courtesy of @EGGHOLIC and my taste buds are thankful. They’re a chain, street Indian food spot, with a bunch of egg based dishes and really good sandwiches. There’s over 26 locations, so you can probably find one near you. When you check em out, you can’t go wrong with the chicken masala sandwiches. As always, make sure you tell em dude lives food sent you. #dudelovesfood #indianfood #CapCut ","It's not fucking breakfast. It's eggaholing. I thought it was going to be egg sushi. Yo, it's dude loves food. We are in Swani, and eggaholing are about to explore our whole world of Indian flavor. Not a respect. Not to try and butcher any of these names, but you're going to see a lot of color. A lot of seasoning, a lot of spices. Absolutely. Noted with food. Honey, honey, honey. We had that, shwarma, curry, ki masala, everything was colorful, flavorful, and affordable. This was around $120, but honestly, you could feed your whole family for like 40. Off the cuff, I'm going to tell you the chicken masala sandwiches were my face. Just seasoned chicken and vegetables, so it was nothing special, but it was just incredible. The cabbabs were decent, but you could get them anywhere. Here's what we started getting a little weird. They channeled their introductory sauce with this minty rice. And I think they actually call it green egg rice. This is my bread in the box. Right right here, it was called lava pilav. Super messy. Not my favorite, but definitely a crowd please. It's an omelet with egg rice, gravy, and cheese. This last dish is the prettiest one. They call it humtum. I just call it beautiful. Vegetarian and it has a little kick to it. It made my nose wet. Save room for dessert, which is fried donuts with ice cream and chai. And so ends our culinary adventure. Next time you're craving some Indian street food, hit up egg holic, and tell them do loves food sent you.",414000,23200,2394,3211,Eggholic - Indian Street Food,"168 Kennedy Rd S #1, Brampton, ON L6W 3G6, Canada",28.10728345123,2
c539f5aa-e9aa-48a6-b0be-b4b36a86a25c,4908bac4-31d5-4a65-af73-4782531bdbb7,b63795ee-f0e9-4f28-8242-5a864459d8ec,gourmetgirlie,https://www.tiktok.com/@gourmetgirlie/video/7187539111362776326,"Name a better deal…now I have dinner for the week 😆 #foryoupage #cheapeats #eastsidemarios #italianfood #torontolife #torontoitalianfood #torontocheapeats #ontariofinds #allyoucaneat #torontorestaurants #torontofood #scarboroughfood #cheapeatstoronto #canadiangirl #pasta #cheese #scarborougheats #torontodeals ",N/A,405200,31700,6432,3776,East Side Mario's,"12 Lebovic Ave Unit 9, Scarborough, ON M1L 4V9, Canada",10.8356823455,5
c5d9ed8d-a2b0-4de2-b68f-aa1c3cf18ae4,496e9166-6ef1-4f3c-a009-9e09f7ea1673,21708ac2-448e-4f65-8af2-714ea2b71332,davebites,https://www.tiktok.com/@davebites/video/7533023014670159109,"Finally got to try Shelby’s after seeing so many videos about it on social media. Admittedly it might have been this particular location or staff that gave me a bad experience so if you can recommend a better location let me know. #shawarma #torontofoodie #foodies #toronto #torontoeats #torontoshawarma #shelbys #shelbyslegendaryshawarma ","[00:00-00:03] This is my honest review of Shelby's legendary Shwarma. [00:03-00:06] I finally got to try this place after seeing it all over social media. [00:06-00:08] I was really excited. I was starving. [00:08-00:15] I ordered my food and as soon as I picked up my food, I knew something was up because it just felt so light. [00:15-00:16] It felt like I was holding a breadstick. [00:16-00:20] And of course when I opened it up, there's just like this tiny little bit of meat in it. [00:20-00:23] And you know, this is supposed to be a legendary-sized Shwarma. [00:23-00:27] It was like $16 for this and definitely not legendarily. [00:27-00:30] This was half the meat that I get at my regular places. [00:30-00:34] So I did feel a bit ripped off and I cannot recommend this place. [00:34-00:37] Maybe you like it. I didn't. Sorry.",400800,10900,404,881,Shelby's Legendary Shawarma - Yonge & Dundas,"357 Yonge St, Toronto, ON M5B 1S5, Canada",0.55857507701,2
fc626f6e-a735-4c07-81f2-f94ec981c2be,3d622dc5-10e7-4759-8458-1b6fe584d58f,17b0a7a9-67a9-4df3-9595-c02fb8361a9a,halalornothing,https://www.tiktok.com/@halalornothing/video/7285064152442359045,Jaw dropping presentation. Insane 🤯#halal #toronto #halalornothing #halalfood #richmondhill #persian,"Start Time	End Time	Subtitle
00:00:00	00:00:01	Let me put you guys
00:00:01	00:00:03	on this halal Persian spot with phenomenal presentation.
00:00:03	00:00:05	This place is called Chef Reza and Richmond Hill.
00:00:05	00:00:08	And this is probably the one restaurant experience I've
00:00:08	00:00:10	had where I was just blown away by the theatrics.
00:00:10	00:00:12	They presented a giant platter of their finest kebabs
00:00:12	00:00:14	like their kubiday and taj kebab,
00:00:14	00:00:16	which were so juicy and delicious.
00:00:16	00:00:18	The mixed appetizers were also amazing
00:00:18	00:00:19	and the rice was fluffy and fragrant.
00:00:19	00:00:21	The interior is beautiful
00:00:21	00:00:23	and they got live entertainment on the weekends.
00:00:23	00:00:24	Definitely check them out.",397400,11600,7293,5427,Chef Reza Richmond Hill,"13071 Yonge St, Richmond Hill, ON L4E 1A5, Canada",33.12977256415,5
7636e858-63ce-4aba-ab7e-63e7fbc7889b,fe24ca01-906d-4cf9-9bc9-fc168bc31fe9,2dc0991e-b528-415c-812a-0ebdc4083fb3,makena.yee,https://www.tiktok.com/@makena.yee/video/7351976244440730922,,1.5% 1.5% 1.5% 1.5% 1.5%,383100,31400,2513,2340,The Food District,"100 City Centre Dr, Mississauga, ON L5B 2C9, Canada",22.23974192583,1
228d6941-6357-4e72-af8f-e438427e9c95,7397f0c4-39ba-47b9-8230-731b386ad0f3,b9b93cac-cdce-4baf-b890-ea43a04a8fa2,thecaroandtina,https://www.tiktok.com/@thecaroandtina/video/7489796446183492907,"🥟🐼🍡🧋such a long wait list hope they come back in the fall😭 they tour around the US! #pandafest #asianfood #foodfestontiktok #streetfood #japanesefood #koreanfood #chinesefood #asiantiktok ","Atlanta's first panda fest is here. It's the most famous Asian food festival in the US. You can enjoy 300 plus variety of authentic street food. Here's everything you should try. This refreshing sugar cane juice with pumpkin is perfect for a hot day. You won't be disappointed by these Hawaiian honeycomb. They taste even better than they look. Of course, you've got to order the grilled squid skewers. Don't be scared. Then make sure you wrap the traditional tongue-rooting candy through. They have several stands because people are obsessed with this. Then head over for some fluffy steamed vows with vegan options too. Now saving the best for last, you cannot leave without the caramel yam ice cream. We're so excited that the panda fest is finally here in Atlanta.",380800,23400,8876,2553,Red Panda Pavilion,"730 Lakeshore Rd E, Mississauga, ON L5G 1J6, Canada",17.33518971249,3
5f984b71-b883-4675-be28-e3e7e2f19a79,035489e3-58e5-40be-92cb-0de393924ab1,77cc71d5-2517-445a-b60b-dd12895bde18,styledtoatea,https://www.tiktok.com/@styledtoatea/video/7120053323733978411,Its that time of the month 🫠 #cinnamonrollrecipe #foryoupage #foodtiktok,The cat made me do it. I had to try the viral cinnamon roll and heavy cream recipe. He's so good at it. He's so good at it. Mixed together three cheese icing and a little heavy cream to make the nuban icing.,372200,4067,1781,1588,Nations Fresh Foods • Mississauga Store,"2933-B Eglinton Ave W, Mississauga, ON L5M 6J3, Canada",29.36048866478,1
dba32934-1403-4c9d-bae8-6dd0e5c212c5,4b0f26fd-209f-4384-bc39-9077f0c58e7f,874628a6-62ed-4bf0-9737-5d64a7559416,yenn12.wu,https://www.tiktok.com/@yenn12.wu/video/7629185111891709197,"Really disappointed in people when they make this type of video.. feels racist in my opinion but what you think? #greenscreenvideo#asian#fypシ゚viral#fyp#china ","[00:00-00:02] Look this gas in this melon juice gas. I don't want to try this. [00:02-00:06] This is negative 100 out of 10. [00:06-00:09] Okay guys, now we'll try interest in Chinese food from supermarket event. [00:09-00:11] She can't see it. I think it'll be horrible, but interesting. Let's do this. [00:11-00:15] I start on something sweet. This is cookies. We've tried something horrible, but this and this. [00:15-00:19] I think it won't be so bad. And next we'll make she give a big... [00:19-00:20] Ah, which way good luck guys. [00:23-00:25] Okay, I don't want to try this at all. [00:25-00:31] This is disgusting. Now it will be dessert. [00:31-00:33] Where's the guys? [00:33-00:37] Oh, smells disgusting. [00:37-00:43] Okay, it looks disgusting. This melon juice gas. [00:43-00:48] I don't want to try. What I'm doing because of the content. Oh my god. [00:50-00:52] I know she said that she's in China. [00:52-00:57] That's why she's trying all these weird, weird strange food from China. [00:57-01:03] But it just feels like when people do this type of video, it just doesn't feel right. [01:03-01:07] Because Matt is respectful and not saying that you cannot live food. [01:07-01:11] You can just live food. You can just not like something. [01:11-01:16] And it's okay for filming it and just making this whole thing of a content. [01:16-01:21] And just keep on saying disgusting. It's like you. [01:21-01:25] Yeah, it doesn't sound right. [01:25-01:30] Also, recording these type of content, it's all optional. [01:30-01:32] You then have to do that, okay? [01:32-01:35] You then have to put yourself in a difficult situation. [01:35-01:37] You could have just kept it. [01:37-01:40] But you choose to do that.",371300,31100,759,1801,Tremendous Chinese Restaurant,"3550 Wolfedale Rd, Mississauga, ON L5C 2V6, Canada",23.37987895316,3
09904c92-652f-429f-861c-c854c9602580,72909cf2-c83e-4c04-b796-d97803009f7f,344f7bb1-8d24-4515-a8a0-24974d1da5f9,aarnvrr,https://www.tiktok.com/@aarnvrr/video/7202752845114838278,"cevapi at mrakovic deli 🔥 #toronto #torontofood #tiktokfood #foodtiktok #hiddengems #hiddengem #hidden #howtotiktok #howtofind #cevapi #grill #iykyk ","Start Time	End Time	Subtitle
00:00:00	00:00:03	Putting you on to ACTUAL hidden gems in Toronto
00:00:03	00:00:04	and here's how to find this one.
00:00:05	00:00:08	At the corner of this intersection in this residential part of a Etobicoke 
00:00:08	00:00:10	you'll find this plaza.
00:00:11	00:00:13	Now it may not look like much,
00:00:13	00:00:16	but if you head inside of this Eastern European grocery store
00:00:16	00:00:19	you'll find one of Toronto's BEST hidden gems.
00:00:19	00:00:22	Now when you walk in you're going to want to walk all the way to the back,
00:00:22	00:00:25	past all the pantry items near the dairy section
00:00:25	00:00:26	and you're going to want to hang a left.
00:00:26	00:00:30	Make that left and you'll end up at this counter.
00:00:30	00:00:31	It may not look like much,
00:00:31	00:00:35	but this back section is home to some of the best cevapi in the city.
00:00:37	00:00:38	And if you don't know what those are
00:00:38	00:00:40	they're basically mini Eastern European sausages.
00:00:40	00:00:43	This place also makes fire burek as well if you're into that stuff.
00:00:43	00:00:46	This is me waiting for my food and here it is.
00:00:46	00:00:50	Now for under $10 you get 5 cevapi on a bun white onions and a drink.
00:00:50	00:00:52	There’s just something about these little guys
00:00:52	00:00:55	cooked over an open fire that make them so damn juicy.
00:00:55	00:00:58	It’s places like this that makes some of Toronto's best food.
00:00:58	00:01:00	You just need to know where to find it.
00:01:00	00:01:02	Episode 2, next week!",370500,27200,3115,5595,Mrakovic Fine Foods Etobicoke,"44 Wellesworth Dr, Etobicoke, ON M9C 4R1",15.83833196307,4
